{
  "mode": "classic",
  "board_size": 20,
  "players": [
    "blue",
    "yellow",
    "red",
    "green"
  ],
  "start_corners": {
    "blue": [
      0,
      0
    ],
    "yellow": [
      19,
      0
    ],
    "red": [
      19,
      19
    ],
    "green": [
      0,
      19
    ]
  },
  "board": [
    "....................",
    "....................",
    "....................",
    "....................",
    "....................",
    "....................",
    "....................",
    "....................",
    "....................",
    "....................",
    "....................",
    "....................",
    "....................",
    "....................",
    "....................",
    "....................",
    "....................",
    "....................",
    "....................",
    "...................."
  ],
  "remaining_pieces": {
    "blue": [
      "F5",
      "I5",
      "L5",
      "N5",
      "P5",
      "T5",
      "U5",
      "V5",
      "W5",
      "X5",
      "Y5",
      "Z5",
      "I4",
      "L4",
      "O4",
      "T4",
      "Z4",
      "I3",
      "V3",
      "I2",
      "I1"
    ],
    "yellow": [
      "F5",
      "I5",
      "L5",
      "N5",
      "P5",
      "T5",
      "U5",
      "V5",
      "W5",
      "X5",
      "Y5",
      "Z5",
      "I4",
      "L4",
      "O4",
      "T4",
      "Z4",
      "I3",
      "V3",
      "I2",
      "I1"
    ],
    "red": [
      "F5",
      "I5",
      "L5",
      "N5",
      "P5",
      "T5",
      "U5",
      "V5",
      "W5",
      "X5",
      "Y5",
      "Z5",
      "I4",
      "L4",
      "O4",
      "T4",
      "Z4",
      "I3",
      "V3",
      "I2",
      "I1"
    ],
    "green": [
      "F5",
      "I5",
      "L5",
      "N5",
      "P5",
      "T5",
      "U5",
      "V5",
      "W5",
      "X5",
      "Y5",
      "Z5",
      "I4",
      "L4",
      "O4",
      "T4",
      "Z4",
      "I3",
      "V3",
      "I2",
      "I1"
    ]
  },
  "history": [],
  "current_player": "blue",
  "consecutive_passes": 0,
  "finished": false,
  "controller_types": {
    "blue": "human",
    "yellow": "human",
    "red": "human",
    "green": "human"
  },
  "controller_strategies": {
    "blue": "default",
    "yellow": "default",
    "red": "default",
    "green": "default"
  }
}
